[
  {
    "id": "skeleton",
    "spriteId": "sprites/skeleton/skeleton",
    "moveSpeed": 2,
    "maxHp": 100,
    "action": {
      "animation": "attack",
      "seekTargetCondition": ["alive", "enemy-team"],
      "distance": 40,
      "cooldown": 120,
      "speed": 30,
      "hitEffect": [{ "type": "dmg", "dmgType": "physical", "power": 20 }]
    },
    "size": 32,
    "effects": [{ "type": "armor", "dmgType": "physical", "power": 10 }]
  },
  {
    "id": "archer",
    "spriteId": "sprites/archer/archer",
    "moveSpeed": 2,
    "maxHp": 100,
    "action": {
      "animation": "attack",
      "seekTargetCondition": ["alive", "enemy-team"],
      "projectileId": "sprites/projectiles/projectile",
      "distance": 400,
      "cooldown": 120,
      "speed": 30,
      "projectileSpeed": 5,
      "hitEffect": [{ "type": "dmg", "dmgType": "physical", "power": 20 }]
    },
    "size": 32
  },
  {
    "id": "necromancer",
    "spriteId": "sprites/inquisitor/inquisitor",
    "moveSpeed": 2,
    "maxHp": 100,
    "action": {
      "animation": "attack",
      "seekTargetCondition": ["dead", "same-team"],
      "distance": 100,
      "cooldown": 500,
      "speed": 60,
      "hitEffect": [{ "type": "revive" }]
    },
    "size": 32
  },
  {
    "id": "priest",
    "spriteId": "sprites/inquisitor/inquisitor",
    "moveSpeed": 2,
    "maxHp": 100,
    "action": {
      "animation": "attack",
      "seekTargetCondition": ["alive", "same-team", "damaged"],
      "distance": 100,
      "cooldown": 150,
      "speed": 60,
      "hitEffect": [{ "type": "heal", "power": 20 }]
    },
    "size": 32
  },
  {
    "id": "steam_dragon",
    "spriteId": "sprites/steam_dragon/Steam Dragon spritesheet",
    "moveSpeed": 2,
    "maxHp": 100,
    "action": {
      "animation": "attack",
      "seekTargetCondition": ["alive", "enemy-team"],
      "distance": 100,
      "cooldown": 150,
      "speed": 60,
      "hitEffect": [
        { "type": "dmg", "dmgType": "fire", "power": 7 },
        { "type": "dmg", "dmgType": "physical", "power": 7 }
      ]
    },
    "size": 32
  }
]
